{"artifact":"exomem-hosted-runtime-upgrade-execution","cells":[],"createdAt":"2026-09-09T21:27:38Z","evidence":{"acceptance":[],"cells":[],"inventory":[],"promotion":[],"release":["0943d69f42a7e9b6e5eaf3c6555a73d5e2596ee2ad6c75b898bf33dd732dfe44"]},"executionId":"runtime-0-77-0-20260909t2115z","inventory":{"cellCount":null,"legacyCellCount":null,"sha256":null,"status":"pending"},"locks":{"contractSha256":null,"expandSha256":null,"pairSha256":null},"phase":"trusted","repositories":{"exomemCommit":null,"substrateConsumerCommit":"73fcd8f605dfb45b56940904738abe3ba2352842"},"result":{"code":"in_progress","nextSafeAction":"deploy_expand"},"schemaVersion":1,"target":{"agentProfile":"hosted-alpha-agent-v4","commandFingerprint":"4b4b71280fec7915042483207b1ab0e15e916148ac1b88ef965e03671de80968","compatibilityDigest":"320e75168c5f72b73551e56f43a82b8d3ee77bf39158ae42ef3292a25b576ec6","gatewayContractDigest":"fa554d6c379d0c98aa8bf9cb31525d1b5be6ff19647afedba35f3e2058b85be1","protocolVersion":"1","releaseVersion":"0.77.0","runtimeCandidateSha256":"fa38854367f564ae33292b5b2f27f0c6ba9aef6a179bccfb98876e3a6be89326","runtimeImage":"ghcr.io/artexis10/exomem@sha256:73ab2439e653d490b800eb810c370e297da0efcad176557756b46b89b5c82172","schemaDigest":"60b5aec6f872874234a214e778e26ce57fa5805af8ce744bdd68efe8ca0fcb26","sourceCommit":"9e7040a3a518627327a1d1287028667cb22bb5b3"},"updatedAt":"2026-09-09T21:27:38Z"}
